title,link
面向虚拟地球的三维气象场可视化方法,[]
双层异步迭代洪水演进模拟算法,[]
基于内接正八面体的近似等积格网变形分析,[]
利用层次约束Delaunay三角网探测空间点事件离群模式,[]
网络结构空间格局相似度分析——以1938~2014年北京市骨干交通网络为例,[]
局部区域表面一致性约束的三维模型纹理映射方法,[]
方差-尺度规律在DEM插值方法评价中的应用,[]
基于平面基元组的建筑物场景点云自动配准方法,[]
自然环境下圆形禁令交通标志检测,[]
GPS和无线电探空的水汽变化与PM2.5/PM10变化的相关性研究,[]
利用改进型TurboEdit算法进行BDS载波相位周跳检测与修复,[]
利用北斗三频非差数据进行周跳实时探测与修复,[]
基于北斗授时和星历的卫星跳频通信方法,[]
利用北斗观测实验网解算北斗卫星差分码偏差,[]
对流层经验改正模型在中国区域的精度评估,[]
RAE并行滤波的重力异常匹配算法,[]
一种分区域的复合相位解缠算法,[]
测量数据不确定性度量的最小模糊熵算法,[]
总体最小二乘联合平差,[]
城市地噪声场的多元分离方法,[]
一种铁路既有线纵断面圆曲线拟合新方法,[]
总目录,[]
