title,link
遥感技术在不透水层提取中的应用与展望,[]
利用GIS与贝叶斯网络进行高分辨率SAR影像道路损毁信息提取,[]
二维线划图中建筑物檐口高自动提取方法,[]
一种TDICCD推扫影像的坐标反变换方法,[]
一种多特征自适应融合的粒子滤波红外目标跟踪方法,[]
地心直角坐标系下的航摄光学影像严密定位模型,[]
建筑物近景可见光影像中树木遮挡区的非监督提取,[]
“天绘一号”海岛(礁)影像稀少控制下的定位技术研究,[]
利用小波核最小噪声分离进行高光谱影像SVM分类,[]
单视全极化SAR图像快速非局部均值滤波,[]
单目图像内静态物体深度的自动测量方法,[]
利用分形和多尺度分析的中低分辨率SAR图像变化检测,[]
分区非局部均值色貌模型在色调映射中的应用,[]
一种大规模点云k邻域快速搜索算法,[]
GIS支持下应用PSO-SVM模型预测滑坡易发性,[]
城市道路网的度相关性及其与网络鲁棒性的关系研究,[]
异步地理信息网络处理服务方法研究,[]
利用非差观测量估计北斗卫星实时精密钟差,[]
GPS单双频混合方法在地表形变监测中的应用,[]
利用GNSS和EGM2008模型进行跨海高程传递,[]
断层三维转动及其引起的地表形变空间分布特征,[]
