title,link
利用视差进行立体像对的建成区检测方法,[]
火星探测巡航段与捕获段光学自主导航方案与关键技术,[]
利用地球立体剖分格网生成Subdivision R-树索引模型,[]
地图自动综合中Beams移位算法的实现与改进,[]
基于多纹理和支持向量机的ZY-102C星HR数据分类,[]
顾及空间交互作用的城市群联动空间增长模拟——以武汉都市区为例,[]
多层独立子空间分析时空特征的人体行为识别方法,[]
利用加权联合协方差矩阵拟合进行干涉相位估计,[]
带有确定度的模糊图像分类,[]
基于扇形筛选法的矢量数据压缩方法,[]
基于深度学习的人体行为识别,[]
空间数据插值的自动化方法研究,[]
GRACE时变重力数据的后处理方法研究进展,[]
一种改进的航空重力测量数据处理方法,[]
利用GPS连续观测进行中国沿海验潮站地壳垂直形变分析,[]
一种新的高动态条件下实时高精度伪距计算方法,[]
利用旋转天线载波相位双差进行欺骗干扰检测技术,[]
安徽CORS参考站三维速度场分析,[]
斜轴墨卡托圆柱投影及其在高速铁路控制网中的应用,[]
利用四元数改进大旋转角坐标变换模型,[]
利用EGM2008模型与地形改正进行GPS高程拟合,[]
南极海冰边界AMSR-E密集度产品精度检验,[]
基于LM方法的大姿态角影像空间后方交会,[]
